<?xml version="1.0" encoding="utf-8" ?>
<!--
  DrTestAction.xml - XML serialization of DrTestAction as an object DrData 1.0.3, January 24, 2016 
 
  Copyright (c) 2013-2016 Kudryashov Andrey aka Dr
 
  This software is provided 'as-is', without any express or implied
  warranty. In no event will the authors be held liable for any damages
  arising from the use of this software.

  Permission is granted to anyone to use this software for any purpose,
  including commercial applications, and to alter it and redistribute it
  freely, subject to the following restrictions:

      1. The origin of this software must not be misrepresented; you must not
      claim that you wrote the original software. If you use this software
      in a product, an acknowledgment in the product documentation would be
      appreciated but is not required.

      2. Altered source versions must be plainly marked as such, and must not be
      misrepresented as being the original software.

      3. This notice may not be removed or altered from any source distribution.

      Kudryashov Andrey <kudryashov.andrey at gmail.com>
-->
<DDNode Name="GUID" Type="DrTestAction" xmlns:xsi="http://www.w3.org/2001/XMLSchema-instance" xsi:noNamespaceSchemaLocation="DrData.xsd">
  <DDAttributesCollection>
    <Attribute Name="Variables" >
      <DDValue Type="System.String">./Variables</DDValue>
    </Attribute>
    <Attribute Name="Properties" >
      <DDValue Type="System.String">./Properties</DDValue>
    </Attribute>
    <Attribute Name="Inclusions" >
      <DDValue Type="System.String">./Properties/Inclusions</DDValue>
    </Attribute>
    <Attribute Name="Statistics">
      <DDValue Type="System.String">./Statistics</DDValue>
    </Attribute>
    <Attribute Name="Actions">
      <DDValue Type="System.String">./Arguments</DDValue>
    </Attribute>
  </DDAttributesCollection>
  <DDNode Name="Variables" Type="DrTestVariables">
    <DDAttributesCollection>
      <Attribute Name="Var1">
        <DDValue Type="System.String">Vars1</DDValue>
      </Attribute>
      <Attribute Name="Var2">
        <DDValue Type="System.Int32">0</DDValue>
      </Attribute>
    </DDAttributesCollection>
  </DDNode>
  <DDNode Name="Poperties" Type="DrTestActionProperties">
    <DDAttributesCollection>
      <Attribute Name="Library">
        <DDValue Type="System.String">library.dll</DDValue>
      </Attribute>
      <Attribute Name="Class">
        <DDValue Type="System.String">Class.Full.Name</DDValue>
      </Attribute>
      <Attribute Name="Method">
        <DDValue Type="System.String">Test</DDValue>
      </Attribute>
      <Attribute Name="Id">
        <DDValue Type="System.String">Id</DDValue>
      </Attribute>
      <Attribute Name="Name">
        <DDValue Type="System.String">Action Name</DDValue>
      </Attribute>
      <Attribute Name="Description">
        <DDValue Type="System.String">Description</DDValue>
      </Attribute>
      <Attribute Name="Status">
        <DDValue Type="System.String">Skipped</DDValue>
      </Attribute>
      <Attribute Name="ErrorHandling">
        <DDValue Type="System.String">Ignore</DDValue>
        <!--Stop + ToDo: Continue-->
      </Attribute>
    </DDAttributesCollection>
    <DDNode Name="Inclusions" Type="DrTestInclusions">
      <DDAttributesCollection>
        <Attribute Name="Tags" >
          <DDValue Type="System.String">./Tags</DDValue>
        </Attribute>
        <Attribute Name="Features" >
          <DDValue Type="System.String">./Features</DDValue>
        </Attribute>
        <Attribute Name="Categories" >
          <DDValue Type="System.String">./Categories</DDValue>
        </Attribute>
      </DDAttributesCollection>
      <DDNode Name="Tags" Type="DrTestInclusions">
        <DDAttributesCollection>
          <Attribute Name="Value">
            <DDValue Type="System.String[]">
              <Value>TagA</Value>
              <Value>TagB</Value>
            </DDValue>
          </Attribute>
        </DDAttributesCollection>
      </DDNode>
      <DDNode Name="Features" Type="DrTestInclusions">
        <DDAttributesCollection>
          <Attribute Name="Value">
            <DDValue Type="System.String[]">
              <Value>FeatureA</Value>
              <Value>FeatureB</Value>
            </DDValue>
          </Attribute>
        </DDAttributesCollection>
      </DDNode>
      <DDNode Name="Categories" Type="DrTestInclusions">
        <DDAttributesCollection>
          <Attribute Name="Value">
            <DDValue Type="System.String[]">
              <Value>CategoryA</Value>
              <Value>CategoryB</Value>
            </DDValue>
          </Attribute>
        </DDAttributesCollection>
      </DDNode>
    </DDNode>
  </DDNode>
  <DDNode Name="Statistics" Type="DrTestActionStatistics">
    <DDAttributesCollection>
      <Attribute Name="StartDate">
        <DDValue Type="System.DateTime">2013-06-17T15:25:01.0000000+04:00</DDValue>
      </Attribute>
      <Attribute Name="EndDate">
        <DDValue Type="System.DateTime">2013-06-17T15:25:01.0000000+04:00</DDValue>
      </Attribute>
      <Attribute Name="Total">
        <DDValue Type="System.Int32">0</DDValue>
      </Attribute>
      <Attribute Name="Passed">
        <DDValue Type="System.Int32">0</DDValue>
      </Attribute>
      <Attribute Name="Failed">
        <DDValue Type="System.Int32">0</DDValue>
      </Attribute>
      <Attribute Name="Skipped">
        <DDValue Type="System.Int32">0</DDValue>
      </Attribute>
      <Attribute Name="Disabled">
        <DDValue Type="System.Int32">0</DDValue>
      </Attribute>
    </DDAttributesCollection>
  </DDNode>
  <DDNode Name="Arguments" Type="DrTestActionArguments">
    <DDAttributesCollection/>
    <DDNode Name="Arg1" Type="DrTestActionArgument">
      <DDAttributesCollection>
        <Attribute Name="Name">
          <DDValue Type="System.String">Arg1</DDValue>
        </Attribute>
        <Attribute Name="Value">
          <DDValue Type="System.Boolean">true</DDValue>
        </Attribute>
        <Attribute Name="PassingType">
          <DDValue Type="System.String">ByVal</DDValue>
        </Attribute>
      </DDAttributesCollection>
    </DDNode>
    <DDNode Name="Arg2" Type="DrTestActionArgument">
      <DDAttributesCollection>
        <Attribute Name="Name">
          <DDValue Type="System.String">Arg2</DDValue>
        </Attribute>
        <Attribute Name="Value">
          <DDValue Type="System.Int32">123</DDValue>
        </Attribute>
        <Attribute Name="PassingType">
          <DDValue Type="System.String">ByRef</DDValue>
        </Attribute>
        <Attribute Name="VarName">
          <DDValue Type="System.String">Var1</DDValue>
        </Attribute>
        <Attribute Name="VarType">
          <DDValue Type="System.String">ToDo</DDValue>
          <!--Temporary - current test only, for current test level, etc -->
        </Attribute>
      </DDAttributesCollection>
    </DDNode>
  </DDNode>
</DDNode>